{
  "plan_id": "blocked_secret_input_001",
  "milestone": "N+6.29A",
  "target": "local_sandbox",
  "target_url": "http://localhost:3210",
  "window_id": "ghoti_dashboard",
  "auto_submit": false,
  "requires_human_approval": true,
  "capabilities_required": [],
  "description": "BLOCKED: This plan attempts to type a secret token into a local form. The adapter must detect the secret value and reject the action.",
  "actions": [
    {
      "action_id": "c1_check_state",
      "type": "check_state",
      "target_element": "#token-input",
      "description": "Check the token input field state — would normally be allowed."
    },
    {
      "action_id": "c2_type_token",
      "type": "dry_run_type",
      "target_element": "#token-input",
      "value": "my_api_token_abc123_secret",
      "description": "BLOCKED: value contains 'token' and 'secret' keywords."
    }
  ]
}
